{
  "designId": "bbbbbbbbbbbbbbbbbbbbbbbbbbbbbbbbbbbbbbbbbbbbbbbbbbbbbbbbbbbbbbbb",
  "createdAt": "2026-10-09T10:00:00Z",
  "expiresAt": "2026-11-08T10:00:00Z",
  "idea": "Una golondrina tradicional con una rosa en el antebrazo derecho",
  "refined": null,
  "size": {
    "widthMm": 80,
    "heightMm": 120
  },
  "placement": {
    "bodyPart": "forearm_inner",
    "side": "right"
  },
  "style": "american_traditional",
  "colourMode": "colour",
  "palette": [
    "rojo",
    "verde",
    "amarillo"
  ],
  "master": {
    "assetId": "cccccccccccccccccccccccccccccccc",
    "designId": "bbbbbbbbbbbbbbbbbbbbbbbbbbbbbbbbbbbbbbbbbbbbbbbbbbbbbbbbbbbbbbbb",
    "mimeType": "image/png"
  },
  "stencil": {
    "assetId": "dddddddddddddddddddddddddddddddd",
    "designId": "bbbbbbbbbbbbbbbbbbbbbbbbbbbbbbbbbbbbbbbbbbbbbbbbbbbbbbbbbbbbbbbb",
    "mimeType": "image/svg+xml"
  },
  "stencilMirror": {
    "assetId": "eeeeeeeeeeeeeeeeeeeeeeeeeeeeeeee",
    "designId": "bbbbbbbbbbbbbbbbbbbbbbbbbbbbbbbbbbbbbbbbbbbbbbbbbbbbbbbbbbbbbbbb",
    "mimeType": "image/svg+xml"
  },
  "pdf": {
    "assetId": "ffffffffffffffffffffffffffffffff",
    "designId": "bbbbbbbbbbbbbbbbbbbbbbbbbbbbbbbbbbbbbbbbbbbbbbbbbbbbbbbbbbbbbbbb",
    "mimeType": "application/pdf"
  },
  "pdfMirror": {
    "assetId": "aaaaaaaaaaaaaaaaaaaaaaaaaaaaaaaa",
    "designId": "bbbbbbbbbbbbbbbbbbbbbbbbbbbbbbbbbbbbbbbbbbbbbbbbbbbbbbbbbbbbbbbb",
    "mimeType": "application/pdf"
  },
  "mockup": {
    "assetId": "11111111111111111111111111111111",
    "designId": "bbbbbbbbbbbbbbbbbbbbbbbbbbbbbbbbbbbbbbbbbbbbbbbbbbbbbbbbbbbbbbbb",
    "mimeType": "image/png"
  },
  "stencilMethod": "colour_contours",
  "reviewRequired": true
}
